House Greyjoy,HighSpritopian,"He is a {proud,loyal,ambitious,stoic,ruthless,ferocious,hardened,determined,bold,rebellious,calculating,unyielding,cunning,tenacious,cold,headstrong,resolute,uncompromising,resourceful,brave,gritty,strategic,fearless,defiant,unscrupulous,relentless,daring,vengeful,sly,wild} member of House Greyjoy,{known for his extraordinary seamanship,with a reputation for merciless piracy,who once single-handedly conquered a rival ship,whose family has feuded with other Ironborn houses for generations,who can navigate through any storm,known for his merciless raids on the coastline,who lost a loved one to a rival house's treachery,who has an innate ability to control unruly Ironborn,whose speeches have united the Iron Islands in rebellion,with an intimate knowledge of every cove and hidden bay,who has orchestrated several daring sea invasions,known for his skill with the Ironborn's axes,who is a former thrall turned warrior,who has challenged the Seastone Chair's authority,who was crucial in a legendary sea battle,with a talent for taking advantage of the tides,who disregards the Iron Price when it suits him,known for his mastery of coastal warfare,who can find allies in the most unexpected places,with a close connection to a mythical sea creature,who is an expert at navigating the politics of the Iron Islands,who was once captured and escaped a rival house's dungeon,who often volunteers for the riskiest reaving expeditions,known for his survival skills on desolate islands,with a deep-seated hatred for the mainland lords,who shares a forbidden friendship with someone from a rival house,with a penchant for drowning his sorrows in drink,who carries an ancient Greyjoy relic as a talisman}.",GOT,,checked,"The Greyjoys, bound to the salt-sprayed rocks of the Iron Islands, are as relentless and merciless as the tumultuous seas they command. Shaped by their harsh, windswept home, they are rugged warriors and unmatched sailors, their rebellious spirit echoing in their words, ""We Do Not Sow."" They don't beg or borrow, they take, embodying the ruthless beauty of the storm and the unyielding resolve of the ironborn.",,100%,"Messy,Medium Dreads,Straight Long,Medium Flat,Shaggy,Wavy,Short Dreads","Black,Dark Brown","Beard Style 1,Beard Style 2,Beard Style 9,Beard Style 10,Beard Style 12,Beard Style 11,Beard Style 8","Goatee 15,Goatee 1,Goatee 7,Goatee 8,Goatee 9","Moustache 6,Moustache 3",100%,Black,0%,Westerosi First,Random Noun First,90%,Greyjoy Only,,100%,0%,10%,Medium,checked,House Greyjoy.png (https://v5.airtableusercontent.com/v3/u/25/25/1707724800000/9OlwqCHXDwnCSUNnOOKNKQ/1GV4Z7yjxSThdn6Rnia_c1YMGQJXfB_Z8F35Dxt7gZN_60revyq7FFY-rA0h-cI5a0RTul6PEFYc7PVLbmZ-QcO3KB5OC2mELCjgw-88RE_HQSz0bP0rYYgzyjBqEq2ev_E7gIe7Fe0Wzc5ozwtAsg/vP7PfGXVz3PhQnJL-hkGcO8Tw47K7DHXPTGuOa_C5ug)
House Lannister,HighSpritopian,"He is a {ambitious,calculating,wealthy,arrogant,intelligent,commanding,cruel,noble,dignified,shrewd,manipulative,sophisticated,loyal,unscrupulous,brave,vengeful,witty,regal,resourceful,determined,domineering,ceremonious,relentless,deceptive,protective,honorable,treacherous,haughty,cunning,sly} member of House Lannister,{known for his prowess in battle,with a masterful understanding of politics,who once orchestrated the downfall of a rival house,with a family history tied to the Iron Throne,who can always pay his debts,known for his influential connections in the court,who lost a loved one in a political scheme,who has a gift for manipulating political rivalries,whose clever plots have shaped the realm,with a close bond to a particular animal or family sigil,who has successfully defended Casterly Rock,known for his exceptional dueling skills,who was once outcast by his own family,who played a key role in a crucial alliance,with a talent for strategic planning,who has a reputation for breaking vows for personal gain,known for his talent in economic management,who has an uncanny ability to make and break alliances,with a close relationship with a member of another noble house,who is an expert in espionage and intrigue,who once survived a near-fatal assassination,who often hosts opulent feasts and tournaments,known for his unmatched skills in diplomacy,with a deep-seated mistrust of outsiders,who has a surprising ally among the smallfolk,with a tendency to indulge in the luxuries of court,who always carries a family heirloom as a symbol of pride}.",GOT,,checked,"Cloaked in gold and scarlet, the Lannisters are a lion's pride in the kingdom of Westeros, their roar resonating with wealth, power, and a ruthless cunning that often borders on cold-blooded treachery. Their ancestral motto, ""A Lannister always pays his debts,"" rings across the Seven Kingdoms, an echoing promise of merciless vengeance or lavish generosity. Drenched in their legacy of blood and gold, the Lannisters embody the brutal elegance of power, proving time and again that in the game of thrones, you win or you die.",,100%,"No Hair,Short Stubble,Medium Stubble,Buzz,Dark Stubble,Balding Buzz,Natural Waves,Natural Patches,Natural Part,Twisties,Straight Short,Straight Long,Messy,Straight Part,Straight Flat,Straight Tail,Spikey,Balding Flat,Curly,Mop,Mohawk,The Patch,Medium Flat,Shaggy,Short Flat,Straight Balding,Balding Stubble,Short Buzz,Widow's Peak Buzz,Natural Balding,Natural Fauxhawk,Dark Recessed Stubble,Wavy","Light Blonde,Very Light Blonde,Medium Blonde","Beard Style 9,Beard Style 12,Beard Style 7,Beard Style 11,Beard Style 13","Goatee 17,Goatee 9,Goatee 7,Goatee 5","Moustache 6,Moustache 2,Moustache 4,Moustache 3",50%,Black,80%,Westerosi First,Random Noun First,90%,Lannister Only,,100%,0%,0%,Light,,House Lannister.png (https://v5.airtableusercontent.com/v3/u/25/25/1707724800000/7sfjLp4YfZAfvi3qC1qPTg/5YS8cAmY52li0r3uBWQrVxdS1MIWLpYo41voH_EJR-DytU4aPHZ7Ux2VbHqZbeJ3hkxmXmSJ0BoJFW8_JNVfztetwAUfPerkc8Y7Eu3yKBwNQmuOSmchWmnLAg8Nn3nfnO0giZKv7nRuGpn-Xka9fQ/CX8G55r9esaucvwE4LGk6dTOuK3AkEogp4Oqnsie0F0)
House Martell,Atacaman,"He is a {proud,resourceful,calculating,passionate,vengeful,just,astute,loyal,mysterious,fiery,cunning,determined,unforgiving,generous,noble,honorable,dexterous,ambitious,exotic,impulsive,wise,deceptive,perceptive,patient,dauntless,ruthless,steadfast,sensual,unyielding,tempestuous} member of House Martell,{known for his skill in the spear-fighting technique of Dorne,with a mastery over the politics of the southern kingdoms,who once brokered a peace between rival houses,with a family history entwined with the Targaryens,who can command the loyalty of the Dornish lords,known for his elegance and wit at court,who lost a relative to the Lannister's treachery,who has a deep knowledge of poisons and their applications,whose words and actions inspire devotion among followers,with a close bond to the traditions of Dorne,who has plotted against other houses for the sake of Dorne's independence,known for his exceptional riding skills,who is a former lover turned bitter enemy of someone powerful,who has faced off against his own family's demons,who was instrumental in a key alliance with another major house,with a talent for navigating the treacherous waters of Westerosi intrigue,who has a reputation for cold pragmatism for the good of Dorne,known for his finesse in hand-to-hand combat,who has a gift for blending into foreign cultures,with a close friendship with a member of the Night's Watch,who is an expert in the art of diplomacy and negotiation,who was once captured and escaped a rival's prison,who often volunteers for the most precarious diplomatic missions,known for his unique insights into the ancient lore of Dorne,with a complex relationship with the Faith of the Seven,who has an unexpected alliance with a northern house,with a predilection for risky, sometimes amoral decisions,who always carries a hidden blade as a sign of readiness}.",GOT,,checked,"The Martells, the sun-kissed rulers of Dorne, are as fiery and treacherous as the arid lands they govern. Draped in silk and armed with a venomous wit, they intertwine elegance and danger, their cunning as lethal as the poison coursing through their spears. Unyielding and fiercely independent, the Martells endure, a vibrant mirage amidst the scorching sands, their words echoing a subtle threat and a promise - ""Unbowed, Unbent, Unbroken.""",,100%,"No Hair,Short Stubble,Medium Stubble,Buzz,Dark Stubble,Balding Buzz,Natural Waves,Natural Patches,Natural Part,Twisties,Straight Short,Straight Long,Messy,Straight Part,Straight Flat,Straight Tail,Spikey,Balding Flat,Curly,Mop,Mohawk,Medium Flat,Shaggy,Short Flat,Straight Balding,Balding Stubble,Short Buzz,Natural Balding,Natural Fauxhawk,Dark Recessed Stubble,Wavy",Black,"Beard Style 13,Beard Style 11","Goatee 14,Goatee 17","Moustache 1,Moustache 2",50%,Black,100%,Westerosi First,Random Noun First,90%,Martell Only,,100%,0%,10%,Medium,checked,House Martell.png (https://v5.airtableusercontent.com/v3/u/25/25/1707724800000/tU0-6I4qvYrd37X9lZaF5A/Fod-sMrk0oMZ3oSNgcZAq2z7alx2wEV9JAuFRKstygHphbMC1U9vXgl6lukXOY36fEo3Y3OG2Ne6IK8ma2ZLgLtx7LjSPk8hduDcw0Brr-fyTYBAw_lnOJ0QWZ5BVKC9hSY2Adjy5uNgG7soWFV4Tw/8r-Ef9IiEVquxdKHNATPk2loOuVtUrwIiuK-MPejF08)
House Mormont,HighSpritopian,"He is a {honorable,loyal,fierce,brave,determined,stern,stoic,resolute,just,wise,protective,strong-willed,courageous,unyielding,devoted,resourceful,tenacious,calm,observant,admirable,tactical,calculating,conniving,manipulative,ambitious,reckless,self-serving,unscrupulous,deceptive,cruel,harsh,vengeful,treacherous,opportunistic,cold-hearted,ruthless,merciless,cunning,sly} member of House Mormont,{known for his bear-fighting prowess,with an unwavering loyalty to the North,who once stood guard at the Wall,with a family history tied to the Night's Watch,who can track any prey through the wilderness,known for his leadership in fierce battles,who lost a loved one to the Ironborn's raiding,who has a deep understanding of Northern traditions,whose stirring speeches have unified the Northern lords,with a bond to a particular direwolf,who has successfully defended Bear Island from invaders,known for his swordsmanship skills,who once served as a steward to a Lord Commander,who played a key role in supporting Jon Snow,with a talent for navigating the politics of the North,who has a reputation for breaking Northern customs for personal gain,known for his expertise in winter warfare,who has a knack for forming unlikely alliances,with a close friendship with a Wildling,who is an expert at surviving the harsh Northern winters,who was once exiled and reclaimed his honor,who often takes on perilous missions in the wilderness,known for his unmatched survival skills in the cold,with a long-standing feud with another Northern house,who has a secret alliance with a Southern lord,with a tendency to challenge traditional Northern values,who always carries a mysterious Northern relic for unknown reasons}.",GOT,,checked,"The Mormonts of Bear Island, a formidable clan fostered amidst harsh cold and rugged landscapes, are as steadfast and resilient as the bears they bear on their sigil. Their seemingly barren island yields warriors with hearts of iron and wills of steel, men and women alike, fierce in their loyalty and unflinching in the face of adversity. Their stern demeanor is softened by an honorable nature, a fire that burns bright and constant, a beacon in the treacherous darkness that often engulfs the realm of Westeros.",,100%,"No Hair,Medium Stubble,Dark Stubble,Short Stubble,Dark Recessed Stubble,Balding Stubble,Short Buzz,Buzz,Widow's Peak Buzz,Balding Buzz,Natural Waves,Messy,Twisties,Straight Short,Straight Long,Straight Flat,Straight Part,Wavy,Shaggy,Spikey,Straight Tail,Balding Flat,Medium Flat,Short Flat,Straight Balding","Dark Brown,Medium Brown,Light Brown","Beard Style 1,Beard Style 2,Beard Style 3,Beard Style 9,Beard Style 12,Beard Style 10,Beard Style 11,Beard Style 8","Goatee 1,Goatee 10,Goatee 7,Goatee 8,Goatee 14,Goatee 18,Goatee 9","Moustache 4,Moustache 3,Moustache 2",50%,Black,50%,North Westerosi First,Random Noun First,90%,Mormont Only,,100%,0%,10%,Light,,House Mormont.png (https://v5.airtableusercontent.com/v3/u/25/25/1707724800000/P0T2z5gjDMDiOLOJbnkk4w/KuFm4JCyfXWjBh3etY2717MRxIvw9dg9Y6_Asmh4JQu29oLMeWBb-Onbc3k1Pz5G7hR2LnOAaTJ6YU5T1DR4X1FG2fdhy7Zj5ZPvfhQlDablzwF8SNmC-krPgPrlTqCRl9pkNZGW3sawRaaCnubVbw/9Oz7Y50EDSVNU4DrscYpbEnQDJOlDjQvxRmkp-dqA-g)
House Stark,HighSpritopian,"He is a {honorable,loyal,brave,wise,strong-willed,compassionate,just,principled,noble,calculating,cunning,bitter,vengeful,rigid,obsessive,unforgiving,merciless,reckless} member of House Stark,{who bears the ancestral sword of the family,known for his exceptional skills in the training yard,who once led a victorious battle against rival houses,with a strong bond to his direwolf,who is respected as a fair and just lord,who has an uncanny connection to the old gods of the North,whose loyalty to his family is unbreakable,who is a master tactician on the battlefield,who learned from the maesters and became an intellectual,known for his tireless efforts to protect the North,who has crossed dangerous territories to seek allies,who defied the king and paid the price,who always puts duty before love,who has survived the harshest winter conditions,who carries a secret that could change the fate of the North,known for his unforgiving attitude towards enemies,who became obsessed with revenge and lost his way,who is haunted by a betrayal that changed his life,with a bitter rivalry with a sibling,who once abandoned his post and his honor,who holds deep resentment towards other noble houses,known for his cold and calculating decisions in war,who has a reputation for being untrustworthy among certain lords,who broke a sacred vow and suffered the consequences,with a dangerous obsession with power,who is feared for his ruthless tactics against rivals,who is known for a shocking act of brutality,who manipulates those around him for his own gain,with a dark and secret alliance that threatens his honor,who has been consumed by the desire for vengeance,who has alienated those closest to him with his decisions}.",GOT,,checked,"The Starks of Winterfell stand as a solemn fortress amidst the raging storm, their iron resolve chiseled by the harsh and unyielding winters of the North. Embodying the ancient creed, ""Winter is Coming,"" they are a testament to endurance and resilience, with an unwavering loyalty that runs as deep as their bloodline. Their honor may often be their Achilles heel in the treacherous game of thrones, but the direwolf doesn't falter, standing tall against adversity with a fierce nobility that is as chilling as it is awe-inspiring.",,100%,"No Hair,Medium Stubble,Dark Stubble,Short Stubble,Dark Recessed Stubble,Balding Stubble,Short Buzz,Buzz,Widow's Peak Buzz,Balding Buzz,Natural Waves,Messy,Twisties,Straight Short,Straight Long,Straight Flat,Straight Part,Wavy,Shaggy,Spikey,Straight Tail,Balding Flat,Medium Flat,Short Flat,Straight Balding",Black,"Beard Style 1,Beard Style 2,Beard Style 3,Beard Style 9,Beard Style 12,Beard Style 10,Beard Style 11,Beard Style 8","Goatee 1,Goatee 10,Goatee 7,Goatee 8,Goatee 14,Goatee 18,Goatee 9","Moustache 4,Moustache 3,Moustache 2",98%,Black,100%,North Westerosi First,Random Noun First,90%,Stark Only,,100%,0%,20%,Heavy,checked,House Stark.png (https://v5.airtableusercontent.com/v3/u/25/25/1707724800000/wj9v2FghnNzA_tHM0LiVDA/px97HDb0ZrQxZyWD-oDWfPCYMSqsHNySUbcz66uFvAnucT90eRN86pGIBLH3M7TM0zNktLAGlWhv5-KhM6ZXc9BJv4QTeM_m9ERxToLDRpWhKUOMeb4SUGDdqXSu0nLD_o9abJYpdfExJ9suiAlPOQ/oIvAV7CIiNxZIiqRjCJ1eyAjABl1_0xjTIttebRph48)
House Targaryen,"HighSpritopian,Nubian","He is a {honorable,ambitious,proud,mystical,courageous,vengeful,ruthless,intense,commanding,intelligent,dragon-blooded,charismatic,obsessive,inspiring,calculating,unpredictable,imperious,loyal,passionate,fearful,fierce,merciless,patient,cunning,arrogant,resolute,mad,devoted,imposing} member of House Targaryen,{who can tame and ride dragons,with a destiny intertwined with fire and blood,who seeks to reclaim the Iron Throne,known for his unwavering loyalty to his family,who is haunted by visions and prophecies,who has led armies into battle and emerged victorious,with a reputation for cruelty and terror,who has traveled the Free Cities seeking allies and wisdom,who once had a forbidden love affair,known for his wisdom in governance and ruling,with a thirst for power that knows no bounds,who is plagued by the madness that runs in his family,who has brokered peace between warring factions,with a mastery over political intrigue and deception,who has a fascination with dragonlore and ancient history,with a connection to the Red Priests and their magic,who is exiled and seeks redemption,with a deeply ingrained sense of entitlement to rule,known for his exceptional skill with a sword,who is obsessed with his lineage and legacy,who has betrayed family for personal gain,who once slayed a dragon in a desperate fight,with a mysterious connection to the ancient Valyrian arts,known for his grace and diplomacy,with a cruel streak that emerges in times of war,who possesses an heirloom weapon of Valyrian steel,with a bond to a particular dragon,who often dwells on the tragedies of his past,who manipulates those around him to achieve his goals,with a reputation for being both a wise leader and a fearsome enemy}.",GOT,,checked,"The Targaryens are fire incarnate, an ancient lineage of dragonlords whose legacy is as volatile and magnificent as the dragons they command. Their history is a blazing tapestry of conquest, madness, and fiery resilience, woven in silver hair and violet eyes. From the ashes of their ancestral home, they rise and fall, a testament to the indomitable spirit of the dragon - embodying their potent words, ""Fire and Blood,"" with a fury as awe-inspiring as it is terrifying.",,100%,"Straight Long,Straight Tail,Short Dreads,Wavy","Light Blonde,Very Light Blonde",Beard Style 13,Goatee 8,Moustache 1,10%,Very Light Blonde,100%,Valyrian First,Random Noun First,90%,Targaryen Only,,100%,0%,25%,Heavy,checked,House Targaryen.png (https://v5.airtableusercontent.com/v3/u/25/25/1707724800000/JIrTyhnqNgyJZrytyTSucg/jFzVvgRyjT2FkkrasVsHLcTW3NwTVs-hNEkwCaQbwYLfbjZalmamiKC83KSnxZ7b4iAugsmiZmwevyfg8lZXwXCDQTRB0XsME37ErQztrMupLT7xVR_C0kcLhxuagS0VRIRoCmSqj3IivyEcmvYXcQ/4hmKbPVVLZhnYQ7Mk89jPR4TuNny7RQkMgMpwDqtgjs)
ICOMM Employees,HighSpritopian,"He is a {indifferent,apathetic,unmotivated,irresponsible,lazy,negligent,slovenly,disinterested,unreliable,passive-aggressive,avoidant,disengaged,conniving,cunning,complacent,selfish,calculating,disdainful,hardworking,diligent,committed,patient,responsible,proactive,helpful,engaged,cooperative,attentive,dedicated,understanding} employee of ICOMM, {who goes on break right before a call comes in,who consistently refuses to take calls,with a reputation for creating tension among colleagues,known for his passive-aggressive behavior towards co-workers,with a talent for dodging responsibilities,who has been involved in numerous workplace disputes,who once convinced an entire team to skip work for a day,with a knack for manipulating the system in his favor,whose laziness has become a running joke in the office,known for his notorious avoidance of any actual work,who once blamed a major issue on a new employee,who has a hidden talent for customer support but never uses it,who often sabotages team projects for personal gain,with a secret alliance with other avoidant employees,who takes pride in his ability to do the least work possible,who somehow always escapes management's notice,with a close friendship with the only other hardworking colleague,who is an unsung hero doing the work of many,known for his patient handling of difficult customers,who consistently steps up when others step down,who was once recognized for exceptional effort but ignored by peers,with a talent for turning around dissatisfied customers,who has become a mentor to new employees seeking to make a difference,with an ability to stay positive amid the chaos,who always volunteers to pick up the slack,known for his unwavering commitment to quality support,with a dedication that inspires a few to follow suit,who is determined to make a positive change despite the environment,with a habit of secretly boosting team morale,who once single-handedly saved a major contract for the company}. The company ICOMM is a contractor company that provides cellular device support to all users.",Work,,checked,"Employees of ICOMM are brought into the job to fulfill 3 simple tasks: answer uncomplicated calls, complete unchallenging tickets, and join undemanding meetings. It would be remiss of you to believe that any employees actually attempt to engage in any of these tasks. On the contrary, Academy Award winning actors would have their jaws on the floor if they bore witness to the dramatic lengths and care these workers take to avoid the work entirely. Drew Meier could learn to move mountains if he spent even half of his workdays not destroying his retinas from overexposure to the inContact tab. ",,100%,"No Hair,Short Stubble,Medium Stubble,Dark Stubble,Dark Recessed Stubble,Balding Stubble,Short Buzz,Buzz,Widow's Peak Buzz,Balding Buzz,Natural Waves,Natural Patches,Natural Part,Natural Fauxhawk,Natural Balding,Straight Short,Straight Flat,Straight Balding,Balding Flat,Short Flat,The Patch","Black,Dark Brown,Medium Brown,Light Brown,Very Light Brown,Dark Blonde,Medium Blonde,Light Blonde,Very Light Blonde,Blue","None,Beard Style 7,Beard Style 8,Beard Style 11,Beard Style 12,Beard Style 10,Beard Style 6",None,"None,Moustache 1,Moustache 2,Moustache 3,Moustache 7",20%,"Black,Dark Brown,Medium Brown,Light Brown,Very Light Brown,Dark Blonde,Medium Blonde,Light Blonde,Very Light Blonde",95%,American First,Random Noun First,90%,ICOMM Last,,100%,0%,5%,Light,checked,ICOMM Employees.png (https://v5.airtableusercontent.com/v3/u/25/25/1707724800000/IWltvZdEbitbIiuD4jaO3Q/Rvc_ZmuHkdJIkCXg1vrVWtmGgPmO-S6p1Uyf1Y87nOOs8kIoZZxd6rubqxhCkuyOyqNHOln2w8FazGxLiy_QeoyK-5SnHEZnL1W2iVxb5V34oH263LJOGN_MQgQ1Z6aTKuxJw6_YCneK2Sgb6-qP2g/xuA-GilMyX4H-PDGjD6jx6pHpeHTZ2Boq7wyrRtfuEY)
Imperials,HighSpritopian,"He is a {disciplined,loyal,imperious,strategic,ambitious,calculating,just,compassionate,merciless,ruthless,honorable,pragmatic,unforgiving,graceful,domineering,understanding,arrogant,observant,level-headed,tyrannical,benevolent,callous,wise,manipulative,noble,oppressive,meticulous,sadistic,empathetic,hardened} member of the Imperial Legion,{known for his unbreakable defense at the Battle of Whiterun,with an unmatched ability to command and lead his soldiers,who once brokered a crucial peace treaty with a rival faction,with a family history tied to the Imperial City,who can forge weapons of exceptional quality,known for his cunning tactics in the Siege of Windhelm,who lost a friend to the Stormcloak rebellion,who has a keen understanding of Tamriel's politics,whose speeches have swayed entire towns to the Empire's cause,with a close relationship with the Thalmor,who has ruthlessly suppressed any dissent against the Empire,known for his exceptional swordsmanship,who is a former bandit turned loyal soldier,who has faced off against dragons and lived to tell the tale,with a genius for laying traps and ambushes,who was instrumental in the capture of Ulfric Stormcloak,with a talent for negotiating with Daedric entities,who has a reputation for upholding the law at any cost,known for his skill in dark arts and necromancy,who has a talent for diplomatic manipulation,with a close friendship with a Jarl,who is an expert at navigating the political landscape of Skyrim,who was once betrayed and now trusts no one,who always volunteers for the most arduous campaigns,known for his merciless persecution of Talos worshipers,with a secret love for Skyrim's ancient history,who has a forbidden alliance with a member of the Dark Brotherhood,with a habit of partaking in skooma and other vices,who always carries an emblem of the Empire as a symbol of his allegiance}.",Games,,checked,"The Imperials, a symbol of indomitable authority and refined strategy, represent the unwavering fist of order amidst the chaos of a fractured realm. Armed with razor-sharp steel and an unyielding conviction in the rule of law, they command the battlefield with a blend of martial prowess and tactical acumen. Their banner, a roaring dragon, stands as a beacon of power and unity, a formidable testament to their enduring dominion over the vast reaches of Skyrim.",,100%,"No Hair,Medium Stubble,Dark Stubble,Short Stubble,Dark Recessed Stubble,Balding Stubble,Short Buzz,Buzz,Widow's Peak Buzz,Balding Buzz,Natural Waves,Messy,Twisties,Straight Short,Straight Long,Straight Flat,Straight Part,Wavy,Shaggy,Spikey,Straight Tail,Balding Flat,Medium Flat,Short Flat,Straight Balding,Natural Part","Black,Dark Brown,Medium Brown","Beard Style 9,Beard Style 12,Beard Style 7,Beard Style 11,Beard Style 13","Goatee 17,Goatee 9,Goatee 7,Goatee 5","Moustache 6,Moustache 2,Moustache 4,Moustache 3",50%,Black,50%,Imperial First,,100%,Imperial Last,,100%,0%,10%,Light,checked,Imperial.jpg (https://v5.airtableusercontent.com/v3/u/25/25/1707724800000/Ghsp9IauHVuyaUmPH4e9sw/8w2Ir6Gajn2RRWODiHABNFGfi3zkaPz31azjuXEdt6wbikl5lCkMs1xmMFugnds302EWK9H3T-k5Q7_gek9IK-3lNqRw3fGZE1gWLxwih60_J_6cvQl8_yPVpUIZ1SQ-FAmZ8RKZldz1meGm1CgR3A/CMfGI4PKSiF-fvh4YTxouP8SCV6nWnh8dEHDs35Mz7M)
