DEA,"HighSpritopian,Atacaman","He is a {determined,unflinching,ethical,thorough,courageous,principled,sharp,meticulous,just,resilient,strategic,analytical,loyal,devoted,observant,ruthless,compromised,obsessive,hard-nosed,cunning,aggressive,ambitious,dogged,persistent,unscrupulous,deceptive,calculating,impatient,manipulative,vengeful} member of the DEA,{known for his relentless pursuit of drug kingpins,with a record of seizing massive amounts of narcotics,who once went undercover with a notorious cartel,with a family history tied to law enforcement,who has solved numerous complex cases,recognized for his exceptional leadership in high-stakes operations,who lost a colleague in the line of duty,who has an uncanny ability to read suspects,whose speeches have inspired fellow agents,with a close bond to a former criminal informant,who has orchestrated major drug busts across the country,known for his exceptional marksmanship,who is a former police officer turned DEA agent,who has taken down high-profile money launderers,who played a key role in a significant legal precedent,with a talent for outthinking criminal enterprises,who has a reputation for bending rules to achieve results,known for his expertise in undercover operations,who has a knack for technological surveillance,with a complex relationship with a defense attorney,who is an expert in international drug laws,who was once suspended for a controversial decision,who often takes on the most challenging assignments,known for his survival skills in dangerous situations,with a simmering distrust for certain colleagues,who has an unexpected connection with a figure from the criminal underworld,with a habit of keeping secrets from his team,who always carries a hidden piece of evidence for leverage}.",Shows,,checked,"The Drug Enforcement Administration (DEA), where the gritty and sharp-witted Hank Schrader serves as a leading agent, stands as a formidable fortress against the growing methamphetamine trade within the U.S. The agency navigates a perilous maze of criminal activity, highlighting its relentless pursuit of justice and law enforcement. Amid the intricate workings of the drug underworld, it is the DEA, under Hank's unwavering leadership, that continuously battles the tide, presenting a stark juxtaposition between the rule of law and the chaos of crime.",,100%,"No Hair,Short Stubble,Medium Stubble,Buzz,Dark Stubble,Balding Buzz,Natural Waves,Natural Patches,Natural Part,Twisties,Straight Short,Straight Long,Messy,Straight Part,Straight Flat,Straight Tail,Spikey,Balding Flat,Curly,Mop,Mohawk,The Patch,Medium Flat,Shaggy,Short Flat,Straight Balding,Balding Stubble,Short Buzz,Widow's Peak Buzz,Natural Balding,Natural Fauxhawk,Dark Recessed Stubble,Wavy","Black,Dark Brown,Medium Brown,Light Brown,Very Light Brown,Dark Blonde,Medium Blonde,Light Blonde,Very Light Blonde","None,Beard Style 1,Beard Style 2,Beard Style 3,Beard Style 4,Beard Style 5,Beard Style 6,Beard Style 7,Beard Style 8,Beard Style 9,Beard Style 10,Beard Style 11,Beard Style 12,Beard Style 13","None,Goatee 2,Goatee 1,Goatee 3,Goatee 4,Goatee 5,Goatee 6,Goatee 7,Goatee 8,Goatee 9,Goatee 10,Goatee 11,Goatee 12,Goatee 13,Goatee 14,Goatee 15,Goatee 16,Goatee 17,Goatee 18,Goatee 19,Goatee 20","Moustache 7,Moustache 2,Moustache 3,None,Moustache 4,Moustache 1,Moustache 5,Moustache 6",50%,"Black,Dark Brown,Medium Brown,Light Brown,Very Light Brown,Dark Blonde,Medium Blonde,Light Blonde,Very Light Blonde",95%,"American First,Hispanic First",,100%,"American Last,Hispanic Last",,100%,75%,10%,Medium,,DEA.png (https://v5.airtableusercontent.com/v3/u/25/25/1707724800000/z1UrNBvSHss_7puKjDO7iQ/QR0YLJdfo4JboNJ6M_28ShsPcR_06X17NjyHOSBUXjO5vkDPp5HRKhtxTi57fNkoUUlLNOA3ZYqAxHjxxi8nA4pLY4WmQYcY99iWLbyRBB6oPjJmrEfFhtogd7F7t9StkPTYGKsJXm7GlxTBU1l1WA/kDwmT7RPfkvrRJo-0yyEmSUUa3JDmlKZiJYUlISbthU)
Death Eaters,HighSpritopian,"He is a {cold,merciless,calculating,fanatical,determined,intimidating,ruthless,obsessive,loyal,unyielding,deceptive,clever,cruel,manipulative,sinister,ambitious,wicked,malevolent,sly,depraved,artful,commanding,haughty,vengeful,insidious,dark,devoted,influential,enigmatic,domineering} member of the Death Eaters,{known for his mastery over the Dark Arts,with a particular affinity for the Unforgivable Curses,who once led a successful raid on the Ministry of Magic,with a family deeply entrenched in dark magic and pure-blood supremacy,who has been instrumental in recruiting new members,known for his cunning tactics against Aurors,who takes perverse pleasure in Muggle torture,who possesses a rare collection of dark artifacts,whose speeches have stirred the passions of dark wizards,with a close association to a particular magical creature of darkness,who has been instrumental in assassinations ordered by Voldemort,known for his skill in Occlumency and Legilimency,who once escaped from Azkaban,who has left a trail of terror in both the Muggle and Wizarding worlds,with an obsession with blood purity and lineage,who has a hidden alliance with a member of the Order of the Phoenix,who specializes in dark potions and poisons,who has a secret hideout filled with dark magic secrets,with an unusual affinity for a particular dark creature,who was once a respected member of the wizarding community but fell from grace,who thrives on sowing discord and fear,known for his prowess in dueling,with a twisted sense of loyalty to Voldemort,who is obsessed with gaining power and influence,who is an expert at creating dark and cursed objects,who has a personal vendetta against a specific Hogwarts house,with a mysterious connection to a prophecy concerning the Dark Lord,who never leaves home without his cursed talisman}.",Movies,,checked,"Death Eaters, the chilling disciples of darkness, paint a picture of fear and awe in the canvas of the wizarding world. Cloaked in black and bearing the sinister Dark Mark, they weave malevolent magic with a frightening elegance. Their allegiance to the Dark Lord is a testament to the enduring lure of power and the terrifying beauty of the abyss, making them a spectral storm under the eerie glow of a skull-framed moon.",Sith,0%,"Wavy,Medium Flat,Shaggy,Twisties,Mohawk","Black,Very Light Blonde,Light Blonde",Beard Style 13,,,50%,Black,0%,English First,,100%,English Last,,100%,0%,30%,Heavy,checked,Death Eaters.png (https://v5.airtableusercontent.com/v3/u/25/25/1707724800000/zzmlBlfbPepnee5V8HXTaw/bZe-DpigKr_chpgT6mQF838ZpGbgj00lfzrfbr90D3Yuwu99IWgOc_-cekjSBgbgn8H1hUW5M5cP1XqNQ-4DzYqgFgRHTLKwA15CgelfoW9ek5jU7VZbmUfppqadbst71IN_HEBKLM4zH7rp2eQyHQ/vHZ-49QIF6qBUKRc9vleIF59AeheeGaU2VgGRs820MY)
Demon Hunters,Elvish,"He is a {focused,relentless,savage,determined,brutal,merciless,astute,unforgiving,agile,disciplined,ferocious,ruthless,loyal,vengeful,quick-thinking,relentless,innovative,wily,passionate,driven,calculating,tactical,cunning,meticulous,dauntless,destructive,unyielding,unapologetic,immoral,resourceful} member of the Demon Hunters,{known for slaying a particularly nefarious demon lord,with an intimate understanding of demonic magic,who once banished an entire demon legion single-handedly,with a personal vendetta against a specific demon clan,whose ability to track demons is unrivaled,consumed by an insatiable thirst for demon blood,who commands respect and fear within the Illidari ranks,whose body is marked with the scars of a thousand battles,known for his agility in aerial combat,who once defied Illidan's direct orders,with a mystical connection to a specific demonic artifact,who draws power from the suffering of his enemies,who harbors a dark secret related to his initiation ritual,with a reputation for showing no mercy to the weak,known for his twisted methods of interrogation,who can detect a demon's presence from miles away,with a unique bond to a spectral beast,who is always at the front line in the battle against the Burning Legion,with an uncanny ability to infiltrate demonic strongholds,who once questioned the morality of the Demon Hunters,who often struggles with his own inner demons,with a knack for weaponizing demonic energy against his foes,who lost everything to the demonic invasion,known for his outstanding leadership in the most desperate battles,with a soft spot for a specific non-demonic creature,who was once a high-ranking member of the enemy forces,who continually wrestles with the fine line between good and evil,with a mysterious connection to a prominent figure in the Burning Legion}.",Games,,checked,"Demon Hunters, the spectral warriors of the shadows, harness the very essence of the demons they vow to annihilate. Sacrificing their sight for spectral vision and infusing their flesh with demonic energy, they walk the razor's edge between darkness and light. Striding through the fires of the Burning Legion with an unbreakable will, they are the terrifying embodiment of vengeance, an unyielding storm against the forces of chaos.",,100%,"No Hair,Short Stubble,Medium Stubble,Buzz,Dark Stubble,Balding Buzz,Natural Waves,Natural Patches,Natural Part,Twisties,Straight Short,Straight Long,Messy,Straight Flat,Straight Tail,Spikey,Balding Flat,Mop,Mohawk,Medium Flat,Shaggy,Short Flat,Straight Balding,Balding Stubble,Short Buzz,Widow's Peak Buzz,Natural Balding,Natural Fauxhawk,Dark Recessed Stubble,Wavy,Thick Cornrows,Thin Cornrows,Afro,Short Dreads,Medium Dreads,Tied Dreads,Dreads Tail,Mop Tail","Green,Red,Blue,Light Blonde,White,Very Light Blonde","Beard Style 3,Beard Style 9,Beard Style 2,Beard Style 1,Beard Style 12,Beard Style 10","Goatee 14,Goatee 10",,100%,"Blue,Green,Red",33%,Demon Hunter First,,100%,Demon Hunter First,,100%,0%,50%,Medium,checked,Demon Hunters.png (https://v5.airtableusercontent.com/v3/u/25/25/1707724800000/98KbtBFRjuqVKfmDHUNv3A/va6lcUSNMvLu31MwfFqxJryNurQG8EP1VaPlT-SqBWOVMTvlsM-RZbUHscEqYTIwdVOEVqOoOFaQ1QbpYChIC1t2EIk7okWVBlg5jsstCrWgdFhWbvlFDiNHQ6zULViCYi7gzOhC97s5durP4clBeg/EW5PcYc7XVOf_5dLkQIhkYhGFqaLAzsWq_jYADE48DQ)
Dothraki,Atacaman,"He is a {fierce,loyal,unyielding,brave,merciless,reckless,spirited,honorable,ruthless,cunning,bold,calculating,free-spirited,wild,imposing,tribal,unpredictable,wise,tempestuous,relentless,adaptive,unforgiving,passionate,intimidating,graceful,terrifying,skilled,domineering,savage,artful} member of the Dothraki,{known for his mastery over horse riding,with an unmatched ability to track prey across the desert,who once defeated a rival Khal in single combat,with a family history tied to a powerful bloodrider,who can craft weapons with exceptional skill,known for his excellent leadership in cavalry charges,who lost a loved one to a rival tribe's brutality,who has a knack for negotiating with foreign cultures,whose fierce battle cries have struck terror into enemies,with a close bond to a particular horse,who has orchestrated several devastating raids on settled cities,known for his precision with an arakh,who was once a slave and fought his way to freedom,who has faced off against a powerful sorcerer,who was crucial in forming a new khalasar,with a talent for creating unexpected battle strategies,who has a reputation for breaking oaths for personal gain,known for his skill in desert survival,who has a knack for recognizing valuable plunder,with a close friendship with a Westerosi,who is an expert at navigating through the desert,who was once captured and escaped a slave trader's clutches,who often volunteers for the most fearsome duels,known for his unparalleled stamina in long journeys,with a deep-seated hatred for city-dwellers,who has a surprising alliance with a foreign queen,with a habit of challenging anyone who looks him in the eye,who always carries a talisman from his first kill}.",GOT,,checked,"The Dothraki, nomadic horse lords of the Great Grass Sea, are the thunder beneath the open sky, an untamed force of nature that bends to no king nor castle. With sun-scorched skin and hearts fueled by the fires of battle, they gallop through life with the strength of stallions, their warrior spirit as boundless as the plains they roam. In a world bound by stone and stratagem, they are the raw, primal scream of freedom and fury, a tempest born of blood and dust.",,100%,Straight Tail,"Black,Dark Brown,Medium Brown","None,Beard Style 1,Beard Style 2,Beard Style 3,Beard Style 4,Beard Style 5,Beard Style 6,Beard Style 7,Beard Style 8,Beard Style 9,Beard Style 10,Beard Style 11,Beard Style 12,Beard Style 13","None,Goatee 1,Goatee 2,Goatee 3,Goatee 4,Goatee 5,Goatee 6,Goatee 7,Goatee 8,Goatee 9,Goatee 10,Goatee 11,Goatee 12,Goatee 13,Goatee 14,Goatee 15,Goatee 16,Goatee 17,Goatee 18,Goatee 19,Goatee 20","None,Moustache 1,Moustache 2,Moustache 3,Moustache 4,Moustache 5,Moustache 6,Moustache 7",75%,Black,95%,"Khal Only,Ko Only,Bloodrider Only",,100%,Dothraki Name,Random Noun First,95%,0%,10%,Medium,checked,Dothraki.png (https://v5.airtableusercontent.com/v3/u/25/25/1707724800000/muh1yrmHHg9ENSfcW3V3pw/V_MkN-ZHYc3zEuKqEjTcWx3vBXIjTlF1UFrJmVoHwncBD8tfRJWrZ49hX0-9U0rWs88Y7LCrjMs5cFMk05xv2u5Klg3ONitMZl8i44OpMo7YsoZaQ621POnxRa-RdyrGtbiPh_3Lg0bn7KayfLN7Jw/IqkqK64Z4WLdQOwrNS7f-61wceGIMp5Mq42SK75fp8o)
Druids,"HighSpritopian,Atacaman,Nubian,Bhutanese,Galactic,Patel,Elvish","He is a {wise,peaceful,harmonious,connected,guardian,feral,restorative,mysterious,elemental,malevolent,cunning,corrupt,vindictive,merciless,deceptive,destructive,chaotic,vicious,betrayer,sadistic,nurturing,healing,understanding,persistent,respectful,vengeful,jealous,greedy,obsessive,manipulative} member of the Druids,{known for his mastery over shapeshifting abilities,who can speak to animals as if they were people,with a special connection to a specific tree or grove,whose healing abilities are sought after in all of Azeroth,who played a crucial role in calming a raging storm,with a bond to the very essence of nature itself,who once saved a village from a disastrous plague,who holds ancient knowledge from the Emerald Dream,with a knack for herbalism and alchemy,who has mentored numerous young Druids,who was instrumental in a battle against the Burning Legion,known for his affinity with the moon and stars,who has communed with ancient and wise Treants,who was once corrupted by dark forces,with a thirst for power that led to betraying his own,who practices forbidden and dark arts,known for his ruthless tactics against those who harm nature,who led a deadly raid on a peaceful village,with a twisted desire to bend nature to his will,who has made pacts with malevolent entities,with a vendetta against other Druidic circles,who always seeks revenge for even minor slights,with an insatiable lust for magical artifacts,who terrorizes those who trespass in his sacred lands,who was once banished for his extreme views,with a dangerous fascination with the Void,who manipulates others for personal gain,with a habit of using his powers to deceive and control,who leaves destruction in his wake without remorse,with an unnerving ability to stalk and hunt his prey}.",Games,,checked,"Druids, the whispered guardians of nature, walk a sacred path intertwined with the primal forces of the earth. Their fingers dance over the weave of life and death, shaping it into forms of healing, growth, and destructive fury, their will flowing in harmony with the ancient rhythms of the world. With the spirits of the wild as their allies and the moon as their guide, they stand as a testament to the profound bond between creation and destruction, life and decay.",,100%,"Shaggy,Wavy,Medium Flat,Natural Part,Messy,Twisties,Tied Dreads,Medium Dreads,Straight Tail,Straight Long,Mohawk,Short Dreads,Mop",Green,"Beard Style 12,Beard Style 2,Beard Style 1,Beard Style 3",Goatee 3,"Moustache 6,Moustache 3",100%,Green,100%,"Irish First,Anglo-Saxon First",,100%,Druid Title,,100%,0%,0%,Light,,Druids.png (https://v5.airtableusercontent.com/v3/u/25/25/1707724800000/yg2DfJOGk1237PFt_3AoeA/GvVJTq4Jb5UY5GP3csi6CWg6DQZs4n5dxgmorTk4eZFj6JFPNTLt1NxU0LbkZNb4klwLG0R1RNW9VVz3qSEtwvTAV3fYGu_ami2qZ0i8qxTbmQ5P0uPtKnWuu5JtrmxeB1ORk5wsQWOTJy0CGzKPAg/wzRkzpccIbD-OnNlibQrkzPIwfXvPGPVMeIClN2mrKg)
E-Corp Executives,HighSpritopian,"They are a {calculating,ambitious,visionary,cunning,innovative,manipulative,pragmatic,unscrupulous,strategic,patient,resourceful,shrewd,sophisticated,charismatic,persuasive,opportunistic,passionate,ruthless,resilient,adaptable,meticulous,domineering,determined,unyielding,intelligent,relentless,insightful,deceptive,professional,tenacious} executive at E-Corp,{who has a reputation for closing multi-billion dollar deals,with a knack for outsmarting rivals in the boardroom,who once orchestrated a major company turnaround,with a hidden agenda that serves personal interests,known for their cutting-edge technological innovations,who was involved in a shadowy corporate conspiracy,with a strong belief in corporate responsibility and ethics,who has a habit of exploiting loopholes for financial gain,known for mentoring young talent into leadership roles,with a dark history of industrial espionage,who takes calculated risks that lead to high rewards,with connections to powerful and questionable individuals,known for negotiating hostile takeovers with finesse,who once betrayed a close colleague for personal gain,with an unshakable commitment to shareholder value,with a penchant for cutting jobs and resources mercilessly,who tirelessly works to improve company culture and morale,known for manipulating markets and regulations,with a reputation for generous charitable donations,who has faced numerous allegations of unethical conduct,known for their diplomatic approach to international relations,with a history of ruthless competition with other tech giants,who sees business as a means to improve society,who has a track record of disregarding employees' well-being,with a talent for fostering collaboration and teamwork,who was implicated in a major financial scandal,known for their exceptional leadership during a corporate crisis,with a tendency to prioritize profits over people,who often navigates complex legal situations with ease,known for their extensive network of political connections,with a hidden soft spot for a particular cause or charity}.",Shows,,checked,"E-Corp Executives, the unseen puppeteers within the labyrinth of corporate power, guide the world's pulse from the comfort of their glass towers. Their decisions, often made over whiskey and encrypted emails, ripple out into society, leaving trails of both innovation and devastation. Wrapped in tailored suits and an air of detached ruthlessness, they navigate the murky waters of global economy, playing a high-stakes game where the chips are human lives.",Suit,0%,"Dark Stubble,Dark Recessed Stubble,Short Buzz,Buzz,Widow's Peak Buzz,Natural Fauxhawk,Afro,Straight Short,Straight Part,Spikey,Straight Flat,Balding Flat,Curly,No Hair,Short Stubble,Natural Waves,Natural Patches","Black,Dark Brown,Medium Brown,Light Brown,Very Light Brown,Dark Blonde,Medium Blonde,Light Blonde,Very Light Blonde","Beard Style 13,Beard Style 8,Beard Style 9,Beard Style 12",,"Moustache 4,Moustache 3",60%,Black,100%,"American First,French First,German First,Swedish First,Norwegian First,Dutch First,English First",,100%,"American Last,French Last,Dutch Last,Norwegian Last,Swedish Last,German Last,English Last",,100%,90%,0%,Light,,E-Corp Executives.jpg (https://v5.airtableusercontent.com/v3/u/25/25/1707724800000/ox6n49yuhf9-Zmrm8OrKmA/g1zUPCsdfZncRC5Slv-ku1WcakMafqgbAuXh4hcfa-5NtKKDCSuKTJz6wfRHtNuCno3XqfZW30ShQB9SuuS0f5ZyT1UGqlg_Mr2dm-csRuOgCjQ1mIAqTvo5tOfyOdv5DuonEYkLD2FY7FyTnZIK3w/enmqnRhJg78480mWJSlEflnGokmCS8pqtpNUbnpw39s)
Enlightened Centrists,"HighSpritopian,Atacaman,Nubian,Bhutanese,Galactic,Patel","He is a {wishy-washy,indecisive,vacillating,ambiguous,noncommittal,evasive,ambiguous,unprincipled,fickle,superficial,disconnected,apathetic,unfocused,tepid,confused,unreliable,wavering,vague,hesitant,contradictory} member of the Enlightened Centrists,{who has flip-flopped on every major issue,with a talent for speaking at length without saying anything,known for his lack of conviction and weak stance,with a library filled with unread literature from all political spectrums,who believes in a watered-down approach to governance,who often hosts tedious debates with no resolution,with a feigned respect for intellectual diversity,who promotes shallow and hollow dialogue,known for never taking a side in any meaningful dispute,with a knack for muddling clear and concise arguments,who stands for everything and thus nothing at all,who has been accused of being a political opportunist,with a history of undermining strong leadership,who has alienated both friends and enemies with his indecision,known for his ability to waffle on any given subject,with a reputation for abandoning principles at the drop of a hat,who has been a bystander in times of moral crisis,known for his refusal to advocate for any real change,with a track record of being a constant disappointment,who often frustrates those seeking genuine progress,with a tendency to muddy the waters of clear debate,who is viewed as a dilettante by many of his peers,with a habit of offering platitudes rather than solutions,known for his insincerity and lack of true insight}.",Society,,checked,"Enlightened Centrists, champions of fence-sitting and self-proclaimed custodians of 'rationality', have perfected the art of agreeing with everyone while committing to nothing. Their philosophy is a kaleidoscope of borrowed ideas, swirling together into a beautiful, albeit, indistinct hodgepodge of 'balance'. They navigate the political battlefield with the grace of a ballet dancer, pirouetting around controversy and leaping over commitment, a masterclass in how to have an opinion without making any waves.",,100%,"No Hair,Short Stubble,Medium Stubble,Buzz,Dark Stubble,Balding Buzz,Natural Waves,Natural Patches,Natural Part,Twisties,Straight Short,Straight Long,Messy,Straight Part,Straight Flat,Straight Tail,Spikey,Balding Flat,Curly,Mop,Mohawk,The Patch,Medium Flat,Shaggy,Short Flat,Straight Balding,Balding Stubble,Short Buzz,Widow's Peak Buzz,Natural Balding,Natural Fauxhawk,Dark Recessed Stubble,Wavy,Thick Cornrows,Thin Cornrows,Afro,Short Dreads,Medium Dreads,Tied Dreads,Dreads Tail,Mop Tail","Black,Dark Brown,Medium Brown,Light Brown,Very Light Brown,Dark Blonde,Medium Blonde,Light Blonde,Very Light Blonde","None,Beard Style 1,Beard Style 2,Beard Style 3,Beard Style 4,Beard Style 5,Beard Style 6,Beard Style 7,Beard Style 8,Beard Style 9,Beard Style 10,Beard Style 11,Beard Style 12,Beard Style 13","None,Goatee 1,Goatee 2,Goatee 3,Goatee 4,Goatee 5,Goatee 6,Goatee 7,Goatee 8,Goatee 9,Goatee 10,Goatee 11,Goatee 12,Goatee 13,Goatee 14,Goatee 15,Goatee 16,Goatee 17,Goatee 18,Goatee 19,Goatee 20","None,Moustache 1,Moustache 2,Moustache 3,Moustache 4,Moustache 5,Moustache 6,Moustache 7",40%,Black,95%,American First,"Hispanic First,African-American First,Roman First,English First",50%,American Last,"Hispanic Last,African-American Last,Roman Last,English Last",50%,90%,5%,Light,,Enlightened Centrists.png (https://v5.airtableusercontent.com/v3/u/25/25/1707724800000/vM7EfxINz3WX2UOuZADxmA/mR0zUshekWNouuWGaufxDJTobdV-rv92PYkjyKqX8ZS5BYioxbAAieO6T5uWEk6qZl-pQsSUs2vzCsEX5yWlFInNB7NLpntm9KoiNqsVVSkAEfphBE_pkK3Niosqz4I2j68EKcQcYzuECMpZUIrQjqw-lgVGAuHttqy64Dtnn-k/ej0NWe2tP24Ln8EKgsU9PIZ6ugA_Whm59N0XPO8wRes)
