Saul Goodman's Clientele,"HighSpritopian,Atacaman,Nubian,Bhutanese,Galactic,Patel","He is a {trustful,calculating,desperate,cunning,manipulative,loyal,shrewd,naive,ambitious,greedy,ingenious,deceptive,fearless,unscrupulous,honest,corrupt,patient,impatient,resilient,sly,dependable,double-dealing,persevering,misguided,humble,arrogant,wary,reckless} member of Saul Goodman's Clientele,{known for his vast network of criminal contacts,with an unbreakable alibi for every occasion,who once pulled off an impossible heist,with a history of white-collar crime,who can charm his way out of any legal situation,known for his elaborate money laundering schemes,who has been wrongfully accused of a terrible crime,who masterminded a nationwide drug empire,with a passion for defending the underdog,who has inside connections with law enforcement,who has a mysterious past linked to a rival lawyer,with an ability to find loopholes in any legal contract,who is always in the wrong place at the wrong time,with a close relationship with a private investigator,who has orchestrated elaborate scams against powerful enemies,known for his knack for disappearing without a trace,who is a reformed criminal turned philanthropist,with a talent for fabricating convincing evidence,who is in deep with a terrifying drug lord,known for his ruthlessness in business negotiations,who has dedicated his life to a noble cause but uses questionable means,with a close friendship with a local politician,who is an expert at manipulating public opinion,who once managed to evade a nationwide manhunt,who regularly volunteers to help those in need,known for his exceptional skill in cyber-crime,with a deep-seated grudge against a particular law firm,who has an unexpected alliance with a high-ranking police officer,with a habit of frequenting shady backroom deals,who always carries a concealed weapon for self-defense}.",Shows,,checked,"Saul Goodman's Clientele is a hodgepodge of sun-baked misfits, desperate schemers, and misguided souls who've mistakenly swapped their moral compass for a 'get out of jail free' card. They're the sort who would consider a briefcase not a carrier of legal documents, but a personal swear jar for their countless indiscretions. Despite the air of chaos that follows them, they're somehow united by an unwavering faith in their silk-talking, legally dubious lifesaver – proving that even in the underbelly of society, brand loyalty exists.",,100%,"No Hair,Short Stubble,Medium Stubble,Dark Stubble,Dark Recessed Stubble,Balding Stubble,Short Buzz,Buzz,Widow's Peak Buzz,Balding Buzz,Natural Waves,Natural Patches,Natural Part,Natural Fauxhawk,Natural Balding,Thick Cornrows,Thin Cornrows,Afro,Messy,Twisties,Short Dreads,Medium Dreads,Tied Dreads,Dreads Tail,Mop,Mop Tail,Straight Short,Straight Long,Straight Flat,Straight Part,Straight Tail,Straight Balding,Spikey,Curly,Balding Flat,Short Flat,Medium Flat,Wavy,Shaggy,Mohawk,The Patch","Black,Dark Brown,Very Light Blonde,Medium Brown,Light Brown","None,Beard Style 1,Beard Style 2,Beard Style 3,Beard Style 4,Beard Style 5,Beard Style 6,Beard Style 7,Beard Style 8,Beard Style 9,Beard Style 10,Beard Style 11,Beard Style 12,Beard Style 13","None,Goatee 1,Goatee 2,Goatee 3,Goatee 4,Goatee 5,Goatee 6,Goatee 7,Goatee 8,Goatee 9,Goatee 10,Goatee 11,Goatee 12,Goatee 13,Goatee 14,Goatee 15,Goatee 16,Goatee 17,Goatee 18,Goatee 19,Goatee 20","None,Moustache 1,Moustache 2,Moustache 3,Moustache 4,Moustache 5,Moustache 6,Moustache 7",65%,Black,100%,American First,Random Noun First,80%,American Last,Random Noun Last,50%,0%,60%,Heavy,,Saul Goodman's Clientele.png (https://v5.airtableusercontent.com/v3/u/25/25/1707724800000/RBgOzuVEr9S8_Wc5r1euSw/rAjMFXxqDXVToIYq52zTZ9mtj4KWWF_UoyfXqmdKpGQhj5jFKsbkt04cDJZ08Ffp3xECfRyBCC3UOBb8P_LSG61TUgUgaRWNQJWbhO9kQoYRsnqjbTLWwvA7DIuk7XExfa7SW4e9g3PQvH0Q1r5nAwIncBPTpHSxdjE-QqMWAJs/z-0RUiHm2wi9bQhSWD-1SIIEy3aeeGvphp4zD1Z21yM)
Sith,"HighSpritopian,Nubian,Atacaman,Galactic,Elvish","He is a {ambitious,power-hungry,calculating,cunning,malevolent,relentless,domineering,manipulative,mysterious,vengeful,insidious,conflicted,brilliant,sadistic,dark,artful,twisted,unpredictable,fearful,fanatical,resolute,deceptive,intimidating,intelligent,supreme,destructive,masterful,obsessive,zealous,devoted} member of the Sith,{known for his mastery over Sith alchemy,with an uncanny ability to manipulate the Dark Side,who once single-handedly crushed a Jedi enclave,with a family legacy steeped in the Sith tradition,who can create Sith artifacts with deadly precision,known for his cruel and tactical leadership,who lost a part of himself to his insatiable lust for power,who has a profound understanding of forbidden techniques,whose venomous speeches have swayed many to the dark side,with a complex connection to a certain Sith holocron,who has masterminded countless massacres of the innocent,known for his impeccable lightsaber dueling skills,who was once a Jedi but fell to darkness,who has hunted down multiple Jedi masters,who was instrumental in overthrowing a key Republic system,with a talent for devising intricate traps for his enemies,who believes that chaos is the only true path to power,known for his mastery in psychological warfare,who has a gift for detecting and exploiting weaknesses,with a haunting connection to an ancient Sith Lord,who excels in the most arcane and forbidden Sith sorcery,who was once imprisoned and tortured by his own Sith brethren,who constantly seeks the next challenge to his dark prowess,known for his ability to survive and thrive in the bleakest of conditions,with an unexplained affinity for a particular Sith beast,who harbors a twisted affection for a Jedi he once knew,with a penchant for collecting trophies from fallen foes,who never goes anywhere without his inscribed Sith amulet}.",Star Wars,,checked,"The Sith are the whispered dread that lurks beneath the galactic twilight, a sinister order fueled by the raw and untamed currents of the dark side of the Force. Their power lies not merely in their fearsome mastery of dark arts, but in their unwavering ambition, their thirst for supremacy sculpting empires and obliterating stars. Embracing their mantra, ""Peace is a lie, there is only passion,"" the Sith are a testament to the cataclysmic allure of unchecked power, a storm of rage and ruthlessness that seeks to engulf the galaxy.",Sith,0%,"No Hair,Dark Stubble,Balding Buzz,Straight Tail,Straight Long,Straight Flat,Short Stubble,Buzz,Wavy,Medium Flat,Mohawk,Short Buzz,Short Dreads",Black,Beard Style 13,"Goatee 14,Goatee 5,Goatee 8,Goatee 7",Moustache 1,40%,Black,95%,Sith Titles,,100%,Sith Name,Random Noun Last,90%,0%,50%,Heavy,checked,Sith.png (https://v5.airtableusercontent.com/v3/u/25/25/1707724800000/i9OTILTzsIBlTiWjdbTKaw/CzImSSBcDX15y9BHmb50z5i074PnDMXB-GD9wSBGiZPOnU-nYzSCfD0bcCFNUYfdhuUu1wzF7HBKetEe5NsCG0QozSJ47d0eVKbcSRaeUipZ0zqjFcFGOHUS53-AG5i7XJ04UN5vh3kHRL7lD8mwAQ/iiJargSa9nKpXnIKLMMt0AHuau7K6u6h9a_ZuZjJHbo)
SLB Employees,Patel,"He is a {inquisitive,panic ridden,annoying,monotoned,way overly curious,stuck up,egotistical,,,,,,,} employee of Schlumberger Technology Corporation, {known for constantly frantically calling tech support,who loves pestering the company's mobile tech support, who has extensive phone issues on the daily, who would literally sell his soul for a company paid Apple watch,,,,,,,.}.",Work,,checked,"SLB Employees are a faction of Patellian humans whose calls for phone assistance to ICOMM are just as much cries for help as they are inquisitorial. If you ever find one in the wilderness, know that you are resigned to engage in 20 minutes of passive interrogation. The sequential pelting of questions with which you have little to no answer for simply adds to the allure of meeting one of these folk. Just ensure you have an eSIM at the ready, and SLB Employee will be happy for you to take their call.","Basic Shirt,Basic Longsleeve",50%,"No Hair,Short Stubble,Medium Stubble,Dark Stubble,Dark Recessed Stubble,Balding Stubble,Short Buzz,Buzz,Widow's Peak Buzz,Balding Buzz,Natural Waves,Natural Patches,Natural Part,Natural Fauxhawk,Natural Balding,Straight Short,Straight Flat,Straight Balding,Balding Flat,Short Flat,The Patch","Black,Dark Brown,Medium Brown,Light Brown,Very Light Brown,Dark Blonde,Medium Blonde,Light Blonde,Very Light Blonde","None,Beard Style 7,Beard Style 8,Beard Style 11,Beard Style 12,Beard Style 10,Beard Style 6","None,Goatee 1,Goatee 2,Goatee 3,Goatee 4,Goatee 5,Goatee 6,Goatee 7,Goatee 10,Goatee 11,Goatee 12,Goatee 13,Goatee 14,Goatee 15,Goatee 16,Goatee 9,Goatee 8,Goatee 17,Goatee 18,Goatee 19,Goatee 20","None,Moustache 1,Moustache 2,Moustache 3,Moustache 7",33%,"Black,Dark Brown,Medium Brown,Light Brown,Very Light Brown,Dark Blonde,Medium Blonde,Light Blonde,Very Light Blonde",95%,Indian First,,100%,Indian Last,Random Noun Last,90%,0%,5%,Light,,SLB Employees.png (https://v5.airtableusercontent.com/v3/u/25/25/1707724800000/_-UUw83hwpfCYk67dbxFTw/6cJIfoarjMU5-N4rxXvUuXN_Juvoh688-1wsP_a8JkOxC1FwDEg4XbpUxv0UP-zjfbphAHSSxtW2yCCyB5EC018ZNdGavEdWkVViJK4OEHRuj7QrECwMYn3RAA2gOe6Vilz2WNiPPOI4oFIHtvnGKg/y66aUIBuLeESNOkgygjLEUYw7YNqkkyJddEzjmKB2MY)
Sludgeservants,Galactic,"He is a {high ranking,,,,,,former} member of the alien Sludge family. The Sludge family is an intergalactic family of alien weirdos.",2K Royals,,checked,"The Sludgeservants are a faction of intergalactic aliens that are mysterious to all but themselves. Their appearance often gives off a ""wow, that thing is pretty fucking creepy"" vibe, and their voices are tonally warped in a way that only adds to the effect. Steer clear of these guys if you know what's good for you. 
",,100%,"No Hair,Short Dreads,Wavy,Medium Flat,The Patch,Shaggy,Mohawk","White,Red,Green,Yellow,Blue,Orange","Beard Style 9,Beard Style 11,Beard Style 13,Beard Style 10","Goatee 19,Goatee 2,Goatee 15,Goatee 17",None,33%,"White,Red,Green,Blue,Yellow,Orange",75%,Sludge Variant First,,100%,Sludge Variant Last,,100%,0%,25%,Light,checked,Sludgeservants.png (https://v5.airtableusercontent.com/v3/u/25/25/1707724800000/wDIRRlJLrStTDW0AzCVd7Q/UpZxnx5pFRHDlM2so__MGzyffFGstXn41AyQIZxlzF9ige0fnBX2b02tf41lvIE4ReEKpuRtWNEjizgmLVifCaEln_9FlFDDbPG922GdkR0IK1ZS-0kXmV4ncUC-sZ4X7lgY3EPWF8Pl_gqn6HyB-A/8ogR-3dOGNp8ybm0OuO5eARln15X-oZwa4QO4Q38f9s)
Social Justice Warriors,"Atacaman,Nubian,HighSpritopian,Bhutanese,Galactic,Patel","He is a {self-proclaimed,overzealous,keyboard-warrior,holier-than-thou,soapbox-standing,virtue-signaling,hashtag-obsessed,triggered,slacktivist,smug,misguided,fanatical,confrontational,uninformed,outrage-addicted,echo-chamber-dwelling,performative,offense-seeking} member of the Social Justice Warriors,{who once tweeted so hard he almost made a difference,with a penchant for canceling people before breakfast,known for his 72-part Twitter threads that no one reads,whose activism extends to sharing memes and changing profile pictures,with a collection of protest signs for every occasion,who can find oppression in a ham sandwich,known for mistaking social media likes for real-world impact,with a degree in Advanced Virtue Signaling from the University of Twitter,who writes angry blogs that his mom thinks are really important,who once fought for justice by unfriending a family member on Facebook,with a remarkable ability to turn any conversation into a lecture on social issues,whose idea of a debate is shouting louder,with a talent for spotting microaggressions in children's cartoons,known for throwing around buzzwords without knowing their meaning,who claims to be vegan but was spotted eating a cheeseburger,with a habit of jumping on the latest outrage bandwagon,who has a collection of participation trophies for online activism,known for his mastery of armchair philosophy,with a tendency to confuse self-righteousness with moral superiority,who often mistakes satire for serious discourse,with an extensive knowledge of logical fallacies, yet frequently commits them,who has a knack for turning allies into enemies with just one tweet,with a trail of blocked Twitter users longer than his list of accomplishments,whose favorite hobby is finding things to be offended about,who believes changing his profile picture is a revolutionary act,with a habit of calling people 'literally Hitler' at the drop of a hat}.",Society,,checked,"Social Justice Warriors, the self-appointed knights of the modern age, are never more than a hashtag away from a cause, their keyboards humming with the heat of outrage. They charge into the battlefield of discourse, armed with a formidable lexicon of buzzwords and an unshakable belief in their own moral superiority. While their passion is commendable, their zealous pursuit of righteousness often bypasses nuance, transforming complex issues into black-and-white battlegrounds and making them the Don Quixotes of social media activism.",,100%,"No Hair,Short Stubble,Medium Stubble,Buzz,Dark Stubble,Balding Buzz,Natural Waves,Natural Patches,Natural Part,Twisties,Straight Short,Straight Long,Messy,Straight Part,Straight Flat,Straight Tail,Spikey,Balding Flat,Curly,Mop,Mohawk,The Patch,Medium Flat,Shaggy,Short Flat,Straight Balding,Balding Stubble,Short Buzz,Widow's Peak Buzz,Natural Balding,Natural Fauxhawk,Dark Recessed Stubble,Wavy,Thick Cornrows,Thin Cornrows,Afro,Short Dreads,Medium Dreads,Tied Dreads,Dreads Tail,Mop Tail","Red,Green,Blue,Yellow,Orange","None,Beard Style 1,Beard Style 2,Beard Style 3,Beard Style 4,Beard Style 5,Beard Style 6,Beard Style 7,Beard Style 8,Beard Style 9,Beard Style 10,Beard Style 11,Beard Style 12,Beard Style 13","None,Goatee 1,Goatee 2,Goatee 3,Goatee 4,Goatee 5,Goatee 6,Goatee 7,Goatee 8,Goatee 9,Goatee 10,Goatee 11,Goatee 12,Goatee 13,Goatee 14,Goatee 15,Goatee 16,Goatee 17,Goatee 18,Goatee 19,Goatee 20","None,Moustache 1,Moustache 2,Moustache 3,Moustache 4,Moustache 5,Moustache 6,Moustache 7",50%,Black,75%,American First,"African-American First,Chinese First,Russian First,French First",50%,American Last,,100%,90%,75%,Light,,Social Justice Warriors.png (https://v5.airtableusercontent.com/v3/u/25/25/1707724800000/Xw4Ui-XmN229C_gaK61w1Q/TCQUkY763sLMvAlxnAJXg1NCTJWwUt1bTBuGvZPCuDlmIYygCigr7BRzyk84-G7qTu22YdUNrqsdHybbCBONIY6CeRApkcCntr7MuGRJLMOYZWG6M9WYDjAhkF0N7JBi__E9TbyKAY1XdgaeN4Xw5IAUTZBL7f2bbRknGBXob2E/1sZ4kdwjh24uzVk6Reo-Bq_d3jE6iDrW7uzEWPUyY-U)
Stormcloaks,HighSpritopian,"He is a {patriotic,defiant,fierce,determined,uncompromising,loyal,brave,freedom-loving,tenacious,headstrong,bold,ruthless,vengeful,bigoted,xenophobic,unforgiving,reckless,opportunistic,manipulative,deceitful} member of the Stormcloaks,{known for his skill in wielding a great axe,with a personal vendetta against the Thalmor,who once single-handedly captured a key Imperial fort,with family members who have been persecuted for their beliefs,who can navigate the harshest terrains of Skyrim,known for his leadership in many successful skirmishes,who lost a family member to Imperial injustice,who has a deep understanding of Nordic history and traditions,whose rousing speeches have rallied many to the cause,with a close bond to a particular war-hound,who has led several crucial ambushes against Imperial patrols,known for his mastery of frost spells,who is a former Imperial soldier turned Stormcloak,who has faced off against Thalmor agents,who was instrumental in seizing the Jagged Crown,with a knack for laying deadly traps for his enemies,who has defied orders for what he believes is right,known for his skill in guerrilla warfare,who harbors a dark secret about his past,with a connection to a certain Daedric Prince,who is known to steal from the very people he vows to protect,who once betrayed a close friend for personal gain,with a thirst for power that exceeds his loyalty to the cause,who enjoys the thrill of battle a little too much,with a suspiciously warm relationship with a Thalmor agent,who is prone to violent outbursts against those he considers traitors,who always carries a token from a foe he vanquished in a dishonorable way}.",Games,,checked,"The Stormcloaks are a roaring tempest of raw, undiluted defiance, a living testament to the untamed spirit of Skyrim's frigid North. Their war cries echo through the mountains, a promise of rebellion and freedom that chills the blood of oppressors. Adorned in fur and ice, they are the stubborn heart of Skyrim, a band of fierce warriors, willing to face death before dishonor in their fight for sovereignty.",,100%,"Straight Long,Mohawk,Dreads Tail,Messy,Mop,Tied Dreads,Wavy,Shaggy","Light Brown,Dark Blonde","Beard Style 9,Beard Style 12,Beard Style 10,Beard Style 2","Goatee 10,Goatee 12","Moustache 3,Moustache 6,Moustache 2",80%,Black,95%,Stormcloak First,Viking First,50%,Stormcloak Last,,100%,0%,66%,Medium,checked,Stormcloaks.jpg (https://v5.airtableusercontent.com/v3/u/25/25/1707724800000/dsplNfYptdcOvz3DsnM2Iw/ftsF-wLgMd3FM334nvMJ254CV9BMUllmQAkW9lKgaUvlteXzbL4Wrc6rzOxx0v0Q1wgh9nskdowgs-wuRvzF8evopWtzyktcCW8zT4vRY1PA8f795zyKxDoR41wvqwZTp0iTxNUkmkogVEzKHpaXFg/uVMCI2sPjCVfFk3gvNvyxTz-_nAD9fveesltZfSDqfg)
Thalmor,Elvish,"He is a {arrogant,ambitious,manipulative,calculating,devoted,sly,dogmatic,ruthless,loyal,astute,commanding,imperious,observant,diplomatic,haughty,resourceful,meticulous,shrewd,cunning,tactical,imposing,contemptuous,authoritative,determined,wise,adaptable,intelligent,resolute,scheming,eloquent} member of the Thalmor,{known for his exceptional skills in the arcane arts,with a reputation for hunting down Talos worshippers,who once brokered a critical alliance with a powerful Jarl,with a family history tied to the Aldmeri Dominion,who can unravel any political intrigue,known for his cold efficiency in rooting out dissidents,who lost a friend to the Nords' resistance,who has a deep knowledge of ancient Elven lore,whose oratory has swayed entire cities,with a close connection to a particular Daedric Prince,who has orchestrated several assassinations of key political figures,known for his remarkable dueling prowess,who was once a spy within the Empire,who played a crucial role in enforcing the White-Gold Concordat,with a talent for manipulating political factions,who has an insatiable thirst for power and control,known for his mastery of Illusion magic,who can infiltrate any gathering undetected,with a fascination for the Dwemer's lost technology,who is an expert at navigating High Elven politics,who was once defeated but escaped capture,who often leads the most critical diplomatic missions,known for his remarkable skill in torturous interrogations,with a genuine belief in the superiority of Mer,who has a surprising understanding of human nature,with a penchant for exquisite and ancient artifacts,who always carries a Thalmor insignia with pride}.",Games,,checked,"The Thalmor, parading around with an air of pompous arrogance, rule with an iron fist wrapped in a silk glove of deception. Proclaiming themselves the saviors of their race, they trample on freedom, concealing their tyranny beneath a veneer of divine mission. These self-aggrandizing zealots of Elven supremacy are but wolves in golden robes, blind to the corrosive nature of their ambition and the animosity they sow in their wake.","Sith,Shirt Pro Max,Shirt Pro Elbow,Shirt Pro Elbow and Wrist",25%,"Dark Stubble,Short Buzz,Buzz,Straight Short,Straight Flat,Balding Flat,Curly,No Hair,Short Stubble,Natural Waves,Wavy,Straight Tail","White,Medium Blonde,Light Blonde,Dark Brown,Dark Blonde",Beard Style 13,,,100%,Black,95%,Justiciar Only,First Emissary Only,90%,Thalmor Name,Skyrim First,90%,0%,0%,Light,,Thalmor.png (https://v5.airtableusercontent.com/v3/u/25/25/1707724800000/6C_6bCdueA5heUmasvuWAg/73tJRaaqZPZGcVs5tpptbFqQq4_hCFpEduS3ZBuvX98tLIxiilfer_QrfO1yr6x9wxcZC-FNINSasXQPjml95KE5todhYeMUgOgFlIVEq68P3eDx3VhcDND-kkqmu6r_W3B1wVtLUzCWNsbd2s7IkQ/XbeRwMcePKFIU-pr0IinYivkOX75BS6QxUDSjx24F0Y)
The Empire,HighSpritopian,"He is a {disciplined,ambitious,authoritative,ruthless,calculating,loyal,efficient,cruel,obsessive,meticulous,fearful,unyielding,stoic,imposing,callous,unrelenting,cunning,strategic,imperialistic,determined,oppressive,logical,domineering,commanding,merciless,manipulative,tenacious,rigid,heartless,sly} member of the Empire from Star Wars,{known for his exceptional TIE Fighter piloting skills,with a track record of suppressing rebel activity,who was instrumental in the destruction of a key rebel base,with connections to the Imperial Royal Guard,who designed advanced weaponry for the Imperial fleet,known for his cold-blooded tactics in battle,who was once a close ally of a Jedi before turning,who has a gift for interrogating rebel prisoners,whose strategies have quashed numerous insurrections,with a close association with a notorious Sith Lord,who has ruthlessly pursued fugitives across the galaxy,known for his precise marksmanship,who was once a hero but has been seduced by the dark side,who has played a key role in Imperial propaganda,with a skill for navigating the complex politics of the Empire,who harbors a secret sympathy for the Rebellion,known for his relentless pursuit of personal power,who has a reputation for betraying allies to further his own interests,known for his mastery in psychological warfare,who secretly doubts the Emperor's vision,with a close connection to a feared Inquisitor,who is a master at espionage and counterintelligence,who survived a betrayal from within the Empire,who has been personally commended by Darth Vader,with a dark secret that could shatter his reputation,who clings to the old ways of the Sith,with a strict adherence to the Imperial code,who has crushed whole worlds in the pursuit of order,who always carries the emblem of the Emperor as a symbol of faith}.",Star Wars,,checked,"The Galactic Empire, an unrelenting monolith of power and control, looms over the galaxy with an iron fist encased in an obsidian glove. Its innumerable fleets of star destroyers, legions of Stormtroopers, and dark force wielders serve as an omnipresent reminder of its indomitable will and the inescapable reach of its long, dark shadow. Unfaltering in their ruthless quest for order and dominion, they are a force to be reckoned with, a relentless titan of terrifying might and cold, calculating precision.",,100%,"No Hair,Dark Stubble,Medium Stubble,Buzz,Dark Recessed Stubble,Natural Waves,Straight Part,Spikey","Black,Dark Brown","Beard Style 9,Beard Style 12,Beard Style 7,Beard Style 11,Beard Style 13","Goatee 17,Goatee 9,Goatee 7,Goatee 5","Moustache 6,Moustache 2,Moustache 4,Moustache 3",50%,Black,100%,Star Wars First,,100%,Star Wars Last,,100%,0%,0%,Light,,The Empire.png (https://v5.airtableusercontent.com/v3/u/25/25/1707724800000/55MPF7sX921vC7Fo2rwKqw/-u4YWztGl4m3Baw5xJ83WPGpBX01tmKBNq9E216GjOZH_Iy2hBeLZxnEVXr3KaA5B8PH4_E-PPsyKTqm3X0EoIeLFFLZc3FIwtn57Fn2ifkzN1zhxv5Z3_t2-O_42GNyGe5fLxBROuqKZN2bd7IKWA/fefAtSucH6IOsl-OgXi4G4iFJs259I8AcK_eXOCRUi8)
The Fatherhood,Atacaman,"He is a {high ranking,,,,,,former} member of the Fatherhood, an council of large, religious, Atacaman priests. {,,,,He is known for helping in the fight against the oppressive Spritopian government.,His teachings and morals were corrupted.,He never truly believed in the Fatherhood teachings.}",2K Royals,,checked,"The Fatherhood is a faction of Atacaman priests who originated the First Spritopian Rebellion. Secretive, cunning, and intelligent, the Fatherhood sparked a resistance which fought off the largest empire in human history -- leaving room for an independent Atacaman state in the western hemisphere. These priests hold no first names, and are only addressed by their given religious title. It would be an honor to have your presence graced by a Father of Atacama. ",,100%,"No Hair,Short Stubble,Medium Stubble,Buzz,Dark Stubble,Balding Buzz,Natural Waves,Natural Patches,Natural Part,Twisties,Straight Short,Straight Long,Messy,Straight Part,Straight Flat,Straight Tail,Spikey,Balding Flat,Curly,Mop,Mohawk,The Patch,Medium Flat,Shaggy,Short Flat,Straight Balding,Balding Stubble,Short Buzz,Widow's Peak Buzz,Natural Balding,Natural Fauxhawk,Dark Recessed Stubble,Wavy","Black,Dark Brown,Gray",None,"Goatee 6,Goatee 13,Goatee 19,Goatee 15,Goatee 16,Goatee 18,Goatee 4,Goatee 5,Goatee 20","Moustache 1,Moustache 5,Moustache 7,Moustache 2",50%,"Black,White",100%,Father Only,,100%,Atacaman Last,Random Noun Last,95%,0%,33%,Medium,checked,The Fatherhood.png (https://v5.airtableusercontent.com/v3/u/25/25/1707724800000/3pcNmYqob0FJSC7rvCMREw/nUl3Tia7OYGjeOfbxg8elxAcCKWPKIFrVuFcptbtlU_sdhfqwsuMD7a6jqduy-jf1N4ZhitIDMIUn1Ofn-G-UdRqkAdH_MRmzApK3HluNgHMWw0V60wEQeQ__bcdj-w5JADGO6B9XZwIiXS0ivuXng/2uJxLsSijR-aw7QUgKMFC29MVvqmtseKWzDcFzm_UfE)
